{
  "meta": {
    "system": "axo",
    "summary": "An agentic terminal harness: a native macOS app and a browser Workbench are clients of a per-user Rust daemon (axod) that owns PTYs, Pi agent processes and the session catalog; a Cloudflare Worker relays remote clients to linked hosts.",
    "source": {
      "repository": "../axo",
      "commit": "66d8d86b7e90fc1478d56cf948a993a16692f0e7"
    },
    "extractedBy": "agent",
    "extraction": "bootstrap",
    "coverage": "First pass. Daemon (axo-server, axo-pty, axo-pi, axo-ipc, axo-relay, axo-protocol), API Worker and pi-axo read in depth; Mac app and web app read at the level of their RPC usage only."
  },
  "actors": [
    {
      "id": "axod",
      "summary": "Per-user daemon. Authoritative owner of Workspaces, Sessions and Panes, their PTYs and Pi processes, the SQLite catalog, and the local JSON-RPC API. Keeps running when the app quits.",
      "transports": [
        "json-rpc-unix-socket",
        "pty-attach-socket",
        "pi-bridge-socket",
        "relay-websocket (outbound)"
      ],
      "anchors": [
        "crates/axod/src/main.rs",
        "crates/axo-server/src/lib.rs",
        "crates/axo-server/src/session.rs"
      ]
    },
    {
      "id": "axo-mac",
      "summary": "SwiftUI macOS app. Registers axod as a LaunchAgent, renders panes with libghostty surfaces, and drives the catalog through local RPC. Holds no authoritative session state.",
      "transports": [
        "json-rpc-unix-socket (client)",
        "pty-attach-socket (client via axod terminal-attach)"
      ],
      "anchors": [
        "apple/AxoMac/Sources/AxoMac/Sessions/TerminalSessionsModel.swift",
        "apple/AxoRPC/Sources/AxoRPC/UnixSocketRPC.swift",
        "apple/AxoDaemonManager/Sources/AxoDaemonManager/DaemonController.swift"
      ]
    },
    {
      "id": "launchd",
      "summary": "macOS service manager. Owns axod's process lifetime once registered through SMAppService.",
      "transports": [
        "ServiceManagement"
      ],
      "anchors": [
        "apple/AxoDaemonManager/Sources/AxoDaemonManager/RegistrationDecision.swift",
        "apple/AxoDaemonManager/Sources/AxoDaemonManager/RestartMethod.swift"
      ]
    },
    {
      "id": "pi",
      "summary": "The Pi agent CLI running interactively in an axod-owned PTY, with the first-party pi-axo extension. Sole writer of its JSONL conversation file.",
      "transports": [
        "pty",
        "pi-bridge-socket (server, inside Pi)"
      ],
      "anchors": [
        "packages/pi-axo/src/extension.ts",
        "packages/pi-axo/src/bridge-server.ts",
        "crates/axo-pi/src/launch.rs"
      ]
    },
    {
      "id": "shell",
      "summary": "The user's configured shell running in an axod-owned PTY.",
      "transports": [
        "pty"
      ],
      "anchors": [
        "crates/axo-pty/src/process.rs",
        "crates/axo-pty/src/command.rs"
      ]
    },
    {
      "id": "api-worker",
      "summary": "Cloudflare Worker at axo.leostera.dev/api. OAuth sign-in, host pairing, and the relay between browser clients and linked hosts.",
      "transports": [
        "https",
        "websocket"
      ],
      "anchors": [
        "packages/axo-api-worker/src/http/router.ts",
        "packages/axo-api-worker/src/index.ts"
      ]
    },
    {
      "id": "account-do",
      "summary": "AxoAccountManager Durable Object, one per Axo account. Owns web sessions, pairings, host memberships and credential verifiers, and hosts the relay sockets for that account's hosts and clients.",
      "transports": [
        "durable-object-rpc",
        "hibernatable-websocket"
      ],
      "anchors": [
        "packages/axo-api-worker/src/auth/account-manager.ts",
        "packages/axo-api-worker/src/axo-host-relay.ts"
      ]
    },
    {
      "id": "identity-index-do",
      "summary": "Maps an OAuth (issuer, subject) to an immutable Axo account ID.",
      "transports": [
        "durable-object-rpc"
      ],
      "anchors": [
        "packages/axo-api-worker/src/auth/account.ts"
      ]
    },
    {
      "id": "pairing-index-do",
      "summary": "Short-lived index from a pairing code to its account, plus pairing rate limiting.",
      "transports": [
        "durable-object-rpc"
      ],
      "anchors": [
        "packages/axo-api-worker/src/auth/pairing-directory.ts"
      ]
    },
    {
      "id": "session-history-do",
      "summary": "AxoSessionDO, one per (account, host, session). Durable server-side copy of structured Pi events.",
      "transports": [
        "durable-object-rpc"
      ],
      "anchors": [
        "packages/axo-api-worker/src/session-history.ts"
      ]
    },
    {
      "id": "web-app",
      "summary": "Browser Workbench at /app. Lists hosts and sessions, drives remote terminals and shows Pi history.",
      "transports": [
        "https",
        "websocket (client)"
      ],
      "anchors": [
        "packages/axo-web-app/src/remote-terminal-app.tsx",
        "packages/axo-web-app/src/pi-history-pane.tsx"
      ]
    },
    {
      "id": "cloudflare-oauth",
      "summary": "External identity provider (dash.cloudflare.com OAuth2).",
      "transports": [
        "https"
      ],
      "anchors": [
        "packages/axo-api-worker/src/auth/provider.ts"
      ]
    },
    {
      "id": "macos-keychain",
      "summary": "Stores the host credential used by axod's relay connection.",
      "transports": [
        "security-framework"
      ],
      "anchors": [
        "crates/axo-relay/src/credential.rs"
      ]
    }
  ],
  "messages": [
    {
      "actor": "axod",
      "transport": "json-rpc-unix-socket",
      "summary": "Newline-delimited JSON-RPC 2.0. Parameters reject unknown fields. Method names are declared once in a table and advertised by negotiation.",
      "accepts": [
        "axo.protocol.negotiate",
        "axo.daemon.health",
        "axo.config.get",
        "axo.config.set",
        "axo.session.list",
        "axo.session.create",
        "axo.session.close",
        "axo.session.rename",
        "axo.session.layout.set",
        "axo.session.subscribe",
        "axo.session.events.next",
        "axo.session.unsubscribe",
        "axo.session.pi.restart.force.v2",
        "axo.session.pi.restart.auto.v1",
        "axo.workspace.list",
        "axo.workspace.create",
        "axo.workspace.rename",
        "axo.workspace.archive",
        "axo.workspace.session.create",
        "axo.shell.create",
        "axo.shell.close",
        "axo.shell.busy",
        "axo.terminal.input",
        "axo.terminal.resize",
        "axo.client.viewport.set",
        "axo.relay.settings",
        "axo.relay.configure",
        "axo.relay.link",
        "axo.relay.disable",
        "axo.relay.status",
        "axo.relay.connect"
      ],
      "emits": [
        "session.snapshot",
        "session.removed",
        "session.focus",
        "shell.activity",
        "terminal.output",
        "pi.event",
        "workspace.changed",
        "relay.status",
        "subscription.lagged"
      ],
      "anchors": [
        "crates/axo-protocol/src/rpc.rs",
        "crates/axo-protocol/src/event.rs",
        "crates/axo-server/src/lib.rs",
        "crates/axo-server/src/session.rs"
      ]
    },
    {
      "actor": "axod",
      "transport": "pty-attach-socket",
      "summary": "Attach protocol v2: client sends a shell ID; axod replies with a rejection code, or a replay length, the PTY master descriptor over SCM_RIGHTS, then replay followed by live output.",
      "accepts": [
        "attach(shellId)"
      ],
      "emits": [
        "rejection",
        "replay+live output",
        "pty master fd"
      ],
      "anchors": [
        "crates/axo-pty/src/attach.rs",
        "crates/axo-server/src/session.rs"
      ]
    },
    {
      "actor": "pi",
      "transport": "pi-bridge-socket",
      "summary": "Newline-delimited JSON over a per-session Unix socket. axod connects and authenticates with the session's bridge token; Pi answers with its identity, then streams events and answers commands.",
      "accepts": [
        "authenticate(token)",
        "command: send / steer / follow-up / cancel / shutdownIfIdle"
      ],
      "emits": [
        "identity",
        "message.*",
        "turn.*",
        "agent.start/end/settled",
        "tool.*",
        "session.info",
        "ui.prompt.start/end",
        "session.resume.requested"
      ],
      "anchors": [
        "crates/axo-pi/src/protocol.rs",
        "crates/axo-pi/src/connection.rs",
        "packages/pi-axo/src/protocol.ts",
        "packages/pi-axo/src/extension.ts"
      ]
    },
    {
      "actor": "account-do",
      "transport": "hibernatable-websocket",
      "summary": "Relay JSON-RPC between hosts (daemon role) and browser clients (client role).",
      "accepts": [
        "axo.host.register",
        "axo.host.heartbeat",
        "axo.host.sessions.publish",
        "axo.transport.ack",
        "axo.remote.session.create",
        "axo.remote.workspace.session.create",
        "axo.remote.session.close",
        "axo.remote.shell.create",
        "axo.remote.shell.close",
        "axo.remote.session.layout.set",
        "axo.remote.terminal.input",
        "axo.remote.terminal.resize"
      ],
      "emits": [
        "host events: session.snapshot, session.removed, shell.activity, terminal.output, pi.event",
        "host presence"
      ],
      "anchors": [
        "packages/axo-api-worker/src/axo-host-relay.ts",
        "crates/axo-relay/src/relay.rs",
        "packages/axo-api/src/v1.ts"
      ]
    },
    {
      "actor": "api-worker",
      "transport": "https",
      "summary": "Public HTTP routes. Account-scoped routes under /api/v1; legacy /v1 routes use synthetic edge principals.",
      "accepts": [
        "/api/auth/cloudflare/start",
        "/api/auth/cloudflare/callback",
        "/api/auth/me",
        "/api/auth/logout",
        "/api/v1/account/host-pairings",